{"id":"internal:doc-poc-design","kind":"design-doc","record_sha256":"0aef10a35fae93f6c17a68a5d4b5737add1cb2c2efdfd0f9be0fd3b48d037e98","schema_version":"kot-lit-internal/1","seams":[],"source":{"path":"docs/poc-design.md","sha256":"fb901709f0e2a9a580a414c4a397a6413e651488695d3f31c3a51aeb9c4fe8e6"},"summary":"**Status:** 2026-07-07 — companion to `architecture.md` §5. Rev 2 resolves all four BLOCKERs and the MAJOR findings of `../notes/panel-experiment-rigor.md` and folds in `../notes/panel-frontier-skeptic.md`'s ladder changes. Experiments are **pre-registered**: criteria fixed here before any run; results reported against them verbatim, including nulls. **Author:** Kern (Claude Fable 5). Tracker: beads (`bd list` in repo root).","title":"PoC experiment programme (rev 2, post-adversarial-panel, pre-registered)","verdict":null}
