{"id":"internal:doc-next-arch-round2-arch-synthesis","kind":"design-doc","record_sha256":"dad1b15ee8d17dfbdb0ba2d75a34603d78b66a8af7ed0a2a352f3f4c26054f74","schema_version":"kot-lit-internal/1","seams":[],"source":{"path":"docs/next/arch/round2-arch-synthesis.md","sha256":"ba12eb016e211c9dd41020a0a7d89b00257967e98907a9b60fc712242e803cf1"},"summary":"> **Provenance + transcription note.** Composed 2026-07-12 by the `synthesis` agent of workflow run > `wf_3870703d-0bb` (`neurosym-arch-exploration`); reviewed by its independent refutation-stance > `review` agent — verdict **SHIP-WITH-FIXES**. This transcription applies three of the review's > fixes: (i) the inputs paragraph now cites the exact committed paths of the design/critique/landscape > docs (extracted to `docs/next/arch/` alongside this file); (ii) the DECONF Stage-B line is corrected ","title":"Kernel-of-Truth round-2 architecture SYNTHESIS — the full-UFO question","verdict":null}
