{"id":"internal:g2","kind":"verdict","record_sha256":"0c3743b001c5867c19f39b863ec8c3748c04d6b80e6402e01762a721371986e5","schema_version":"kot-lit-internal/1","seams":["HS2"],"source":{"path":"registry/verdicts/g2.json","sha256":"f87d681571ef1a46909843abdad6c662edddbe50a377142d9b79e92da85b249a"},"summary":"Experiment g2: verdict INSTRUMENT-INVALID. Hypotheses: HS2. Endpoints: primary(primary)=0.3098574237770816; sec-kappa(secondary)=0.6429872495446267; sec-litmus(secondary)=True. Coverage fraction 0.3542 on rung molecules-v0 (measured scope only). Kill criterion (verbatim): P1 §4 HS2 kill criterion (verbatim): 'Precision <0.9 ⇒ Π demoted to lint; all axioms live in the authored sidecar (option b). Test: one-sided exact binomial vs the 0.9 threshold over n = 500 gold subsumption judgments (raised from the earlier ~50–100 plan per P7 RT-4: P8 §1.6 shows n=100 is undecidable unless true precision ≳0.96; n=500 makes the 0.9 gate decidable at realistic precision — this sizing is the worked example for the freeze-time decidability lint above), α=0.05 — the Wilson 95% lower bound must clear 0.9; inter-annotator agreement (Cohen's κ) reported, disagreements adjudicated blind before scoring. Additional kill for Π-as-normative if Π conflicts with any endorsed sidecar axiom on v0 (deterministic check, no test).' Extrapolation envelope (verbatim): P1 §4b row HS2–HS8 (verbatim): Measured range: R0 — no host model. Reasonable extrapolation envelope: Model-scale-free (properties of the kernel formalism); the relevant axis is KERNEL size: verdicts on 54–10³ records re-checked at 10⁴–10⁵ during bulk authoring (G6/G7 re-run as regression). Literature anchor + licensing assumption: Formal-fragment properties don't vary with observer scale; only corpus composition shifts them.","title":"Registry verdict: g2","verdict":"INSTRUMENT-INVALID"}
