{"id":"internal:g7","kind":"verdict","record_sha256":"84ba45b009995efa33c682dec250138793afe4dc11390854523eb19197912b59","schema_version":"kot-lit-internal/1","seams":["HS7"],"source":{"path":"registry/verdicts/g7.json","sha256":"cff7d231ce0a1c7a4961e54da9c63fe5c440821a05854ffd7019d2afd649b545"},"summary":"Experiment g7: verdict FAIL. Hypotheses: HS7. Endpoints: primary(primary)=0.9133665255854587. Coverage fraction 0.3542 on rung molecules-v0 (measured scope only). Kill criterion (verbatim): P1 §4 HS7 statement + kill (verbatim): '(HS7) inlining relational content forces cap violations or >1.5× clause growth on >10% of records at bulk scale ⇒ apply-clauses (kot-ast/2) win; else defer.' Kill (P1 §8): 'cap violations/1.5× growth >10% ⇒ kot-ast/2.' Kill criteria are the numeric bounds from NF6, verbatim. FAIL here means the fork selects kot-ast/2 (a design selection, not a programme kill). Extrapolation envelope (verbatim): P1 §4b row HS2–HS8 (verbatim): Measured range: R0 — no host model. Reasonable extrapolation envelope: Model-scale-free (properties of the kernel formalism); the relevant axis is KERNEL size: verdicts on 54–10³ records re-checked at 10⁴–10⁵ during bulk authoring (G6/G7 re-run as regression). Literature anchor + licensing assumption: Formal-fragment properties don't vary with observer scale; only corpus composition shifts them.","title":"Registry verdict: g7","verdict":"FAIL"}
