{"id":"internal:doc-next-arch-round2-candidate-designs","kind":"design-doc","record_sha256":"26e7845c6b31152671f0f1888a978f2ee48d190ba612e97dd1bbcdcc2c067aba","schema_version":"kot-lit-internal/1","seams":[],"source":{"path":"docs/next/arch/round2-candidate-designs.md","sha256":"1977bc2107222619d52302938b035e15632df23a2865d4f3bafdcb256bd2cb55"},"summary":"> **Provenance.** Extracted 2026-07-12 from the `neurosym-arch-exploration` workflow run > `wf_3870703d-0bb` (journal: `~/.claude/projects/-home-ec2-user-css/85798a0b-4e71-4020-b0b9-ac1fed9631d0/subagents/workflows/wf_3870703d-0bb/journal.jsonl`). > Agent-output text is **verbatim**; only markdown scaffolding (headings, lists, tables) was added. > [PROPOSED-ASM-1500] The journal carries no label field; outputs were mapped to the script's agent > labels by structural schema match + the `name` fie","title":"Round-2 candidate architecture designs + critiques (non-full-UFO)","verdict":null}
