{"id":"internal:doc-next-analysis-rules1b-form-misattribution","kind":"design-doc","record_sha256":"c442ba6c9554780d126017d8bafaea885b4330d8ef1a1a16663df42de1d5f434","schema_version":"kot-lit-internal/1","seams":[],"source":{"path":"docs/next/analysis/rules1b-form-misattribution.md","sha256":"f97056c2cfe8a453d84ec10fd6ea08288b5f826a85f0f80362cb025c3e19816d"},"summary":"**Status: diagnosed and fixed 2026-07-12 (Fable); successor DRAFT `registry/experiments/rules-1-c.json` (supersedes rules-1-b, frozen `2b81375e…`), dry-run-clean; re-freeze is the coordinator's.** Companion to `docs/next/analysis/rules1-void-degenerate-instrument.md` (the rules-1 void). No final-phase GPU was spent: the launch gate refused fail-closed (`ERR_GATE_PILOT: pilot acc(A5)=0.0000 below the frozen host-validity floor 0.15`).","title":"RULES-1-B host-validity floor failure — form mis-attribution (diagnosis + fix)","verdict":null}
